{"schema_version":"0.2.9","uncertainty_id":"uncertainty:reference-base-current","generated_at":"2026-08-23T00:30:00+00:00","method":"stratified_empirical_binomial_sha256_v1","seed":"ctcl-itr-v0.2.9-reference-20260823","replicates":256,"interval_p":0.9,"minimum_supported_fraction":0.5,"base_snapshot_id":"snapshot:base","current_snapshot_id":"snapshot:current","comparison_id":"comparison:base-current","measurement_contract":{"unit":"interaction_depth","reliability_p":0.9,"scope_id":"scope:reference","assessment_method":"monotone_binomial_pava_v1"},"conditioning":{"composition_resampled":false,"observed_family_weights_fixed":true,"reference_family_weights_fixed":true,"trial_counts_fixed":true,"success_counts_resampled":true},"point_estimate_context":{"reference_family_weights":{"code":0.5,"research":0.5},"context_diagnostics":{"backend_changed":true,"benchmark_version_changed":false,"agent_config_changed":false,"family_set_changed":false,"comparison_kind":"cross_backend"},"attribution_boundary":"composition_standardization_only"},"subjects":{"autonomy":{"point_estimate":{"observed_mix_delta":-0.6000000000000005,"composition_adjusted_delta":0.8470588235294114,"composition_residual":-1.447058823529412,"composition_total_variation":0.6},"bands":{"observed_base_horizon":{"supported_replicates":195,"total_replicates":256,"supported_fraction":0.76171875,"support_status":"supported","band":{"lower":6.347058823529412,"median":7.1111111111111125,"upper":7.600000000000001},"mean":7.084286067647248},"observed_current_horizon":{"supported_replicates":222,"total_replicates":256,"supported_fraction":0.8671875,"support_status":"supported","band":{"lower":6.201111111111112,"median":6.6,"upper":7.142857142857143},"mean":6.614984307708766},"observed_mix_delta":{"supported_replicates":169,"total_replicates":256,"supported_fraction":0.66015625,"support_status":"supported","band":{"lower":-1.1627450980392158,"median":-0.5142857142857133,"upper":0.4397824397824379},"mean":-0.44983196909391404},"reference_base_horizon":{"supported_replicates":252,"total_replicates":256,"supported_fraction":0.984375,"support_status":"supported","band":{"lower":5.257846153846153,"median":6.361655773420479,"upper":7.076923076923077},"mean":6.3158312832967605},"reference_current_horizon":{"supported_replicates":198,"total_replicates":256,"supported_fraction":0.7734375,"support_status":"supported","band":{"lower":6.75,"median":7.142857142857142,"upper":7.714285714285713},"mean":7.158036379789124},"composition_adjusted_delta":{"supported_replicates":195,"total_replicates":256,"supported_fraction":0.76171875,"support_status":"supported","band":{"lower":-0.13522727272727283,"median":0.761904761904761,"upper":2.0768218623481767},"mean":0.8451430267767238},"composition_residual":{"supported_replicates":150,"total_replicates":256,"supported_fraction":0.5859375,"support_status":"supported","band":{"lower":-2.1640952380952405,"median":-1.4607142857142863,"upper":-0.8927731630131626},"mean":-1.4620937881625231}},"family_delta_bands":{"code":{"supported_replicates":223,"total_replicates":256,"supported_fraction":0.87109375,"support_status":"supported","band":{"lower":0.4684848484848485,"median":1.5,"upper":5.299999999999991},"mean":1.947476495449354},"research":{"supported_replicates":253,"total_replicates":256,"supported_fraction":0.98828125,"support_status":"supported","band":{"lower":-0.554545454545455,"median":0.39999999999999947,"upper":1.818181818181816},"mean":0.543114376062038}},"sign_shares":{"observed_mix_delta":{"positive":0.15384615384615385,"negative":0.8165680473372781,"zero":0.029585798816568046},"composition_adjusted_delta":{"positive":0.9282051282051282,"negative":0.07179487179487179,"zero":0.0}},"unsupported_reason_counts":{"base_observed:family_unsupported:research":2,"base_observed:target_not_bracketed_high":59,"base_reference:family_unsupported:research":2,"base_reference:target_not_bracketed_high":2,"current_observed:family_unsupported:code":33,"current_observed:family_unsupported:research":1,"current_observed:target_not_bracketed_high":1,"current_reference:family_unsupported:code":33,"current_reference:family_unsupported:research":1,"current_reference:target_not_bracketed_high":25,"family_unsupported:code":33,"family_unsupported:research":3,"target_not_bracketed_high":79}},"governance":{"point_estimate":{"observed_mix_delta":-0.39999999999999947,"composition_adjusted_delta":0.8923076923076918,"composition_residual":-1.2923076923076913,"composition_total_variation":0.6},"bands":{"observed_base_horizon":{"supported_replicates":229,"total_replicates":256,"supported_fraction":0.89453125,"support_status":"supported","band":{"lower":5.000000000000004,"median":6.0,"upper":6.666666666666667},"mean":5.928087336114302},"observed_current_horizon":{"supported_replicates":222,"total_replicates":256,"supported_fraction":0.8671875,"support_status":"supported","band":{"lower":5.222222222222223,"median":5.6000000000000005,"upper":6.000000000000002},"mean":5.600525827731711},"observed_mix_delta":{"supported_replicates":195,"total_replicates":256,"supported_fraction":0.76171875,"support_status":"supported","band":{"lower":-1.2718137254901971,"median":-0.3333333333333339,"upper":0.6170334928229649},"mean":-0.3154043303741841},"reference_base_horizon":{"supported_replicates":254,"total_replicates":256,"supported_fraction":0.9921875,"support_status":"supported","band":{"lower":4.2518218623481765,"median":5.32258064516129,"upper":5.865142857142857},"mean":5.227670691679229},"reference_current_horizon":{"supported_replicates":203,"total_replicates":256,"supported_fraction":0.79296875,"support_status":"supported","band":{"lower":5.75,"median":6.142857142857142,"upper":6.7142857142857135},"mean":6.178363112787917},"composition_adjusted_delta":{"supported_replicates":201,"total_replicates":256,"supported_fraction":0.78515625,"support_status":"supported","band":{"lower":0.08333333333333212,"median":0.9000000000000012,"upper":2.0427807486631018},"mean":0.9539714979328483},"composition_residual":{"supported_replicates":178,"total_replicates":256,"supported_fraction":0.6953125,"support_status":"supported","band":{"lower":-2.4227380952380946,"median":-1.2872421695951104,"upper":-0.8176816239316254},"mean":-1.3696984923331221}},"family_delta_bands":{"code":{"supported_replicates":222,"total_replicates":256,"supported_fraction":0.8671875,"support_status":"supported","band":{"lower":0.3859634551495003,"median":1.25,"upper":4.311666666666663},"mean":1.6100565412963161},"research":{"supported_replicates":254,"total_replicates":256,"supported_fraction":0.9921875,"support_status":"supported","band":{"lower":-0.33333333333333304,"median":0.39999999999999947,"upper":1.733333333333333},"mean":0.5799860559645179}},"sign_shares":{"observed_mix_delta":{"positive":0.26153846153846155,"negative":0.7128205128205128,"zero":0.02564102564102564},"composition_adjusted_delta":{"positive":0.9601990049751243,"negative":0.024875621890547265,"zero":0.014925373134328358}},"unsupported_reason_counts":{"base_observed:family_unsupported:research":2,"base_observed:target_not_bracketed_high":25,"base_reference:family_unsupported:research":2,"current_observed:family_unsupported:code":34,"current_reference:family_unsupported:code":34,"current_reference:target_not_bracketed_high":19,"family_unsupported:code":34,"family_unsupported:research":2,"target_not_bracketed_high":42}}},"interpretation_boundary":"conditional_outcome_sampling_uncertainty_only","non_authoritative":true}